{
  "dataset_id": "pubg-finish-placement-prediction",
  "provider": "kaggle",
  "slug": "daniboy370/pubg-finish-placement-prediction",
  "archive_path": "data/archives/pubg-finish-placement-prediction.zip",
  "archive_checksum": "a1b2c3d4e5f67890123456789abcdef0123456789abcdef0123456789abcdef0",
  "extracted_path": "data/extracted/pubg-finish-placement-prediction",
  "selected_file": "train_V2.csv",
  "total_records": 4446966,
  "status": "ready",
  "created_at": "2026-07-28T01:00:00Z"
}
